movieId,title,genres,year,rated,runtime,director,writer,actors,plot,language,country,awards,imdb_rating,imdb_votes
3608,Pee-wee's Big Adventure,Adventure|Comedy,1985,PG,91 min,Tim Burton,Michael Varhol|Paul Reubens|Phil Hartman,"Paul Reubens, Elizabeth Daily, Mark Holton, Diane Salinger","When eccentric man-child Pee-wee Herman gets his beloved bike stolen in broad daylight, he sets out across the U.S. on the adventure of his life.",English|French,USA,2 nominations.,7.0,46065.0
928,Rebecca,Drama|Mystery|Romance|Thriller,1940,NOT RATED,130 min,Alfred Hitchcock,Daphne Du Maurier (celebrated novel)|Joan Harrison (screen play)|Michael Hogan (adaptation)|Philip MacDonald (adaptation)|Robert E. Sherwood (screen play),"Laurence Olivier, Joan Fontaine, George Sanders, Judith Anderson",A self-conscious bride is tormented by the memory of her husband's dead first wife.,English|French,USA,Won 2 Oscars. Another 4 wins & 10 nominations.,8.1,108780.0
1234,The Sting,Comedy|Crime,1973,PG,129 min,George Roy Hill,David S. Ward,"Paul Newman, Robert Redford, Robert Shaw, Charles Durning",Two grifters team up to pull off the ultimate con.,English,USA,Won 7 Oscars. Another 11 wins & 6 nominations.,8.3,215191.0
1230,Annie Hall,Comedy|Romance,1977,PG,93 min,Woody Allen,Marshall Brickman|Woody Allen,"Woody Allen, Diane Keaton, Tony Roberts, Carol Kane",Neurotic New York comedian Alvy Singer falls in love with the ditzy Annie Hall.,English|German,USA,Won 4 Oscars. Another 26 wins & 8 nominations.,8.0,234164.0
1960,The Last Emperor,Drama,1987,PG-13,163 min,Bernardo Bertolucci,Bernardo Bertolucci (screenplay)|Enzo Ungari (initial screenplay collaboration)|Mark Peploe (screenplay),"John Lone, Joan Chen, Peter O'Toole, Ruocheng Ying",The story of the final Emperor of China.,English|Japanese|Mandarin,China|France|Italy|UK,Won 9 Oscars. Another 47 wins & 16 nominations.,7.8,83757.0
2728,Spartacus,Action|Drama|Romance|War,1960,PG-13,197 min,Stanley Kubrick,Dalton Trumbo (screenplay)|Howard Fast (based on the novel by),"Kirk Douglas, Laurence Olivier, Jean Simmons, Charles Laughton",The slave Spartacus leads a violent revolt against the decadent Roman Republic.,English,USA,Won 4 Oscars. Another 7 wins & 11 nominations.,7.9,111543.0
509,The Piano,Drama|Romance,1993,R,121 min,Jane Campion,Jane Campion,"Holly Hunter, Harvey Keitel, Sam Neill, Anna Paquin","A mute woman is sent to 1850s New Zealand along with her young daughter and prized piano for an arranged marriage to a wealthy landowner, but is soon lusted after by a local worker on the plantation.",British Sign Language|English|Maori,Australia|France|New Zealand,Won 3 Oscars. Another 60 wins & 56 nominations.,7.6,72152.0
1459,Absolute Power,Mystery|Thriller,1997,R,121 min,Clint Eastwood,David Baldacci (book)|William Goldman (screenplay),"Clint Eastwood, Gene Hackman, Ed Harris, Laura Linney",A career thief witnesses a horrific crime involving the U.S. President.,English|Spanish,USA,1 nomination.,6.7,45481.0
750,Dr. Strangelove or: How I Learned to Stop Worrying and Love the Bomb,Comedy|War,1964,PG,95 min,Stanley Kubrick,"""Peter George (based on the book: """"Red Alert"""" by)|Peter George (screenplay)|Stanley Kubrick (screenplay)|Terry Southern (screenplay)""","Peter Sellers, George C. Scott, Sterling Hayden, Keenan Wynn",An insane general triggers a path to nuclear holocaust that a War Room full of politicians and generals frantically tries to stop.,English|Russian,UK|USA,Nominated for 4 Oscars. Another 13 wins & 7 nominations.,8.4,407153.0
951,His Girl Friday,Comedy|Romance,1940,PASSED,92 min,Howard Hawks,"""Ben Hecht (from the play """"The Front Page"""")|Charles Lederer (screen play)|Charles MacArthur (from the play """"The Front Page"""")""","Cary Grant, Rosalind Russell, Ralph Bellamy, Gene Lockhart",A newspaper editor uses every trick in the book to keep his ace reporter ex-wife from remarrying.,English|French,USA,2 wins.,8.0,47856.0
1660,Eve's Bayou,Drama,1997,R,109 min,Kasi Lemmons,Kasi Lemmons,"Jurnee Smollett-Bell, Meagan Good, Lynn Whitfield, Samuel L. Jackson","After a daughter witnesses her father having an affair, she begins a chain reaction that could tear her family apart.",English,USA,11 wins & 17 nominations.,7.3,7666.0
3168,Easy Rider,Adventure|Drama,1969,R,95 min,Dennis Hopper,Dennis Hopper|Peter Fonda|Terry Southern,"Peter Fonda, Dennis Hopper, Antonio Mendoza, Phil Spector","Through the open country and desert lands, two bikers head from L.A to New Orleans, and along the way, meet a man who bridges a counter-culture gap they are unaware of.",English|Spanish,USA,Nominated for 2 Oscars. Another 8 wins & 12 nominations.,7.4,87071.0
3518,The End of Violence,Drama|Thriller,1997,R,122 min,Wim Wenders,Nicholas Klein|Nicholas Klein (story)|Wim Wenders (story),"Traci Lind, Rosalind Chao, Bill Pullman, Andie MacDowell",Mike Max is a Hollywood producer who became powerful and rich thanks to brutal and bloody action films. His ignored wife Paige is close to leaving him. Suddenly Mike is kidnapped by two ...,English|Spanish,France|Germany|USA,1 win & 4 nominations.,5.6,4418.0
527,Schindler's List,Drama|War,1993,R,195 min,Steven Spielberg,Steven Zaillian (screenplay)|Thomas Keneally (book),"Liam Neeson, Ben Kingsley, Ralph Fiennes, Caroline Goodall","In German-occupied Poland during World War II, Oskar Schindler gradually becomes concerned for his Jewish workforce after witnessing their persecution by the Nazi Germans.",English|German|Hebrew|Polish,USA,Won 7 Oscars. Another 82 wins & 49 nominations.,8.9,1064602.0
1343,Cape Fear,Thriller,1991,R,128 min,Martin Scorsese,James R. Webb (earlier screenplay)|John D. MacDonald (novel)|Wesley Strick (screenplay),"Robert De Niro, Nick Nolte, Jessica Lange, Juliette Lewis","A convicted rapist, released from prison after serving a fourteen-year sentence, stalks the family of the lawyer who originally defended him.",English,USA,Nominated for 2 Oscars. Another 4 wins & 17 nominations.,7.3,151365.0
1639,Chasing Amy,Comedy|Drama|Romance,1997,R,113 min,Kevin Smith,Kevin Smith,"Ethan Suplee, Ben Affleck, Scott Mosier, Jason Lee","Holden and Banky are comic book artists. Everything's going good for them until they meet Alyssa, also a comic book artist. Holden falls for her, but his hopes are crushed when he finds out she's a lesbian.",English,USA,Nominated for 1 Golden Globe. Another 5 wins & 15 nominations.,7.3,124383.0
82,Antonia's Line,Comedy|Drama,1995,R,102 min,Marleen Gorris,Marleen Gorris,"Willeke van Ammelrooy, Els Dottermans, Dora van der Groen, Veerle van Overloop","A Dutch matron establishes and, for several generations, oversees a close-knit, matriarchal community where feminism and liberalism thrive.",Dutch,Belgium|France|Netherlands|UK,Won 1 Oscar. Another 6 wins & 8 nominations.,7.5,7612.0
3044,Dead Again,Mystery|Romance|Thriller,1991,R,107 min,Kenneth Branagh,Scott Frank,"Kenneth Branagh, Andy Garcia, Emma Thompson, Lois Hall","A woman who has lost her memory is taken in by a Los Angeles orphanage, and a private eye is enlisted to track down her identity, but he soon finds that he might have a past life connection to her that endangers their lives.",English,USA,Nominated for 1 Golden Globe. Another 1 win & 4 nominations.,7.0,24007.0
3317,Wonder Boys,Comedy|Drama,2000,R,107 min,Curtis Hanson,Michael Chabon (novel)|Steve Kloves (screenplay),"Michael Douglas, Tobey Maguire, Frances McDormand, Robert Downey Jr.","An English Professor tries to deal with his wife leaving him, the arrival of his editor who has been waiting for his book for seven years, and the various problems that his friends and associates involve him in.",English,Germany|Japan|UK|USA,Won 1 Oscar. Another 19 wins & 46 nominations.,7.4,58251.0
356,Forrest Gump,Comedy|Drama|Romance|War,1994,PG-13,142 min,Robert Zemeckis,Eric Roth (screenplay)|Winston Groom (novel),"Tom Hanks, Rebecca Williams, Sally Field, Michael Conner Humphreys","The presidencies of Kennedy and Johnson, Vietnam, Watergate, and other history unfold through the perspective of an Alabama man with an IQ of 75.",English,USA,Won 6 Oscars. Another 40 wins & 67 nominations.,8.8,1566365.0
3185,Snow Falling on Cedars,Drama,1999,PG-13,127 min,Scott Hicks,David Guterson (novel)|Ronald Bass (screenplay)|Scott Hicks (screenplay),"Ethan Hawke, Yûki Kudô, Reeve Carney, Anne Suzuki","A Japanese-American fisherman is accused of killing his neighbor at sea. In the 1950s, race figures into the trial. So does reporter Ishmael.",English|German|Japanese,USA,Nominated for 1 Oscar. Another 5 wins & 9 nominations.,6.8,13119.0
25,Leaving Las Vegas,Drama|Romance,1995,R,111 min,Mike Figgis,John O'Brien (based upon the novel by)|Mike Figgis (screenplay by),"Nicolas Cage, Elisabeth Shue, Julian Sands, Richard Lewis","Ben Sanderson, a Hollywood screenwriter who lost everything because of his alcoholism, arrives in Las Vegas to drink himself to death. There, he meets and forms an uneasy friendship and non-interference pact with prostitute Sera.",English|Russian,France|UK|USA,Won 1 Oscar. Another 30 wins & 26 nominations.,7.5,105449.0
2112,Grand Canyon,Crime|Drama,1991,R,134 min,Lawrence Kasdan,Lawrence Kasdan|Meg Kasdan,"Danny Glover, Kevin Kline, Steve Martin, Mary McDonnell",Grand Canyon revolved around six residents from different backgrounds whose lives intertwine in modern-day Los Angeles. At the center of the film is the unlikely friendship of two men from ...,English,USA,Nominated for 1 Oscar. Another 3 wins & 3 nominations.,6.9,13846.0
2858,American Beauty,Drama|Romance,1999,R,122 min,Sam Mendes,Alan Ball,"Kevin Spacey, Annette Bening, Thora Birch, Wes Bentley",A sexually frustrated suburban father has a mid-life crisis after becoming infatuated with his daughter's best friend.,English,USA,Won 5 Oscars. Another 104 wins & 100 nominations.,8.4,974483.0
1213,Goodfellas,Crime|Drama,1990,R,146 min,Martin Scorsese,Martin Scorsese (screenplay)|Nicholas Pileggi (book)|Nicholas Pileggi (screenplay),"Robert De Niro, Ray Liotta, Joe Pesci, Lorraine Bracco","The story of Henry Hill and his life in the mob, covering his relationship with his wife Karen Hill and his mob partners Jimmy Conway and Tommy DeVito in the Italian-American crime syndicate.",English|Italian,USA,Won 1 Oscar. Another 43 wins & 37 nominations.,8.7,886287.0
3994,Unbreakable,Drama|Sci-Fi,2000,PG-13,106 min,M. Night Shyamalan,M. Night Shyamalan,"Bruce Willis, Samuel L. Jackson, Robin Wright, Spencer Treat Clark",A man learns something extraordinary about himself after a devastating accident.,English,USA,2 wins & 13 nominations.,7.3,328303.0
4055,Panic,Drama,2000,R,88 min,Henry Bromell,Henry Bromell,"William H. Macy, John Ritter, Neve Campbell, Donald Sutherland","Alex, a hit man, tries to get out of the family business, but his father won't let him do so. While seeking the help of a therapist, he meets a sexually charged 23-year-old woman with whom he falls in love.",English,USA,2 nominations.,6.8,7506.0
1912,Out of Sight,Comedy|Crime|Drama|Romance|Thriller,1998,R,123 min,Steven Soderbergh,Elmore Leonard (novel)|Scott Frank (screenplay),"George Clooney, Jennifer Lopez, Jim Robinson, Mike Malone","A career bank robber breaks out of jail, and shares a moment of mutual attraction with a U.S. Marshal he has kidnapped.",English,USA,Nominated for 2 Oscars. Another 13 wins & 12 nominations.,7.0,79090.0
6870,Mystic River,Crime|Drama|Mystery,2003,R,138 min,Clint Eastwood,Brian Helgeland (screenplay)|Dennis Lehane (novel),"Sean Penn, Tim Robbins, Kevin Bacon, Laurence Fishburne",The lives of three men who were childhood friends are shattered when one of them has a family tragedy.,English,Australia|USA,Won 2 Oscars. Another 53 wins & 142 nominations.,8.0,383089.0
1221,The Godfather: Part II,Crime|Drama,1974,R,202 min,Francis Ford Coppola,Francis Ford Coppola (screenplay by)|Mario Puzo (based on the novel by)|Mario Puzo (screenplay by),"Al Pacino, Robert Duvall, Diane Keaton, Robert De Niro","The early life and career of Vito Corleone in 1920s New York City is portrayed, while his son, Michael, expands and tightens his grip on the family crime syndicate.",English|Italian|Latin|Sicilian|Spanish,USA,Won 6 Oscars. Another 11 wins & 20 nominations.,9.0,974448.0
1289,Koyaanisqatsi,Documentary,1982,NOT RATED,86 min,Godfrey Reggio,Alton Walpole|Godfrey Reggio|Michael Hoenig|Ron Fricke,"Lou Dobbs, Ted Koppel","A collection of expertly photographed phenomena with no conventional plot. The footage focuses on nature, humanity and the relationship between them.",None,USA,5 wins & 1 nomination.,8.3,31325.0
21,Get Shorty,Comedy|Crime|Thriller,1995,R,105 min,Barry Sonnenfeld,Elmore Leonard (novel)|Scott Frank (screenplay),"John Travolta, Gene Hackman, Rene Russo, Danny DeVito","A mobster travels to Hollywood to collect a debt, and discovers that the movie business is much the same as his current job.",English,USA,Won 1 Golden Globe. Another 5 wins & 15 nominations.,6.9,70139.0
3246,Malcolm X,Drama,1992,PG-13,202 min,Spike Lee,Alex Haley (book)|Arnold Perl (screenplay)|Malcolm X (book)|Spike Lee (screenplay),"Denzel Washington, Angela Bassett, Albert Hall, Al Freeman Jr.","Biographical epic of the controversial and influential Black Nationalist leader, from his early life and career as a small-time gangster, to his ministry as a member of the Nation of Islam.",English,Japan|USA,Nominated for 2 Oscars. Another 18 wins & 22 nominations.,7.7,74314.0
492,Manhattan Murder Mystery,Comedy|Mystery,1993,PG,104 min,Woody Allen,Marshall Brickman|Woody Allen,"Woody Allen, Diane Keaton, Jerry Adler, Lynn Cohen",A middle-aged couple suspects foul play when their neighbor's wife suddenly drops dead.,English,USA,Nominated for 1 Golden Globe. Another 3 nominations.,7.4,33350.0
866,Bound,Crime|Drama|Romance|Thriller,1996,R,109 min,Lana Wachowski|Lilly Wachowski,Lana Wachowski|Lilly Wachowski,"Jennifer Tilly, Gina Gershon, Joe Pantoliano, John P. Ryan","Corky, a tough female ex con and her lover Violet concoct a scheme to steal millions of stashed mob money and pin the blame on Violet's crooked boyfriend Caesar.",English|Italian,USA,8 wins & 13 nominations.,7.4,46477.0
3507,The Odd Couple,Comedy,1968,G,105 min,Gene Saks,Neil Simon (from the play by)|Neil Simon (screenplay),"Jack Lemmon, Walter Matthau, John Fiedler, Herb Edelman","Two friends try sharing an apartment, but their ideas of housekeeping and lifestyles are as different as night and day.",English,USA,Nominated for 2 Oscars. Another 3 wins & 7 nominations.,7.7,28721.0
2130,Atlantic City,Crime|Drama|Romance,1980,R,104 min,Louis Malle,John Guare,"Burt Lancaster, Susan Sarandon, Kate Reid, Michel Piccoli","In a corrupt city, a small-time gangster and the estranged wife of a pot dealer find themselves thrown together in an escapade of love, money, drugs and danger.",English|French,Canada|France,Nominated for 5 Oscars. Another 25 wins & 16 nominations.,7.4,13001.0
2352,The Big Chill,Comedy|Drama,1983,R,105 min,Lawrence Kasdan,Barbara Benedek|Lawrence Kasdan,"Tom Berenger, Glenn Close, Jeff Goldblum, William Hurt",A group of seven former college friends gather for a weekend reunion at a South Carolina vacation home after the funeral of another of their college friends.,English,USA,Nominated for 3 Oscars. Another 3 wins & 5 nominations.,7.2,29651.0
3081,Sleepy Hollow,Fantasy|Horror|Mystery|Romance,1999,R,105 min,Tim Burton,"""Andrew Kevin Walker (screen story)|Andrew Kevin Walker (screenplay)|Kevin Yagher (screen story)|Washington Irving (story """"The Legend of Sleepy Hollow"""")""","Johnny Depp, Christina Ricci, Miranda Richardson, Michael Gambon","Ichabod Crane is sent to Sleepy Hollow to investigate the decapitations of three people, with the culprit being the legendary apparition, The Headless Horseman.",English|Latin,Germany|USA,Won 1 Oscar. Another 23 wins & 39 nominations.,7.4,302552.0
1282,Fantasia,Animation|Children|Fantasy|Musical,1940,G,125 min,Ben Sharpsteen|Bill Roberts|David Hand|Ford Beebe Jr.|Hamilton Luske|James Algar|Jim Handley|Norman Ferguson|Paul Satterfield|Samuel Armstrong|T. Hee|Wilfred Jackson,Albert Heath (story development)|Arthur Heinemann (story development)|Bianca Majolie (story development)|Bill Peet (story development)|Campbell Grant (story development)|Carl Fallberg (story development)|Dick Huemer (story direction)|Elmer Plummer (story development)|Erdman Penner (story development)|Graham Heid (story development)|Joe Grant (story direction)|John McLeish (story development and research)|Joseph Sabo (story development)|Lee Blair (story development)|Leo Thiele (story development and research)|Norman Wright (story development)|Otto Englander (story development)|Perce Pearce (story development)|Phil Dike (story development)|Phil Dike (story development)|Robert Sterner (story development and research)|Sylvia Moberly-Holland (story development)|Vernon Stallings (story development)|Webb Smith (story development)|William Martin (story development and research),"Leopold Stokowski, Deems Taylor",A collection of animated interpretations of great works of Western classical music.,English,USA,8 wins & 1 nomination.,7.8,80987.0
1906,Mr. Jealousy,Comedy|Romance,1997,R,103 min,Noah Baumbach,Noah Baumbach,"Eric Stoltz, Annabella Sciorra, Chris Eigeman, Carlos Jacott",Lester is an occasional substitute teacher and he's very jealous. He is jealous about the last boyfriend of Lester's slightly wacky current partner Ramona - arrogant best-selling author ...,English,USA,N/A,6.5,1688.0
3396,The Muppet Movie,Adventure|Children|Comedy|Musical,1979,G,95 min,James Frawley,Jack Burns|Jerry Juhl,"Jim Henson, Frank Oz, Jerry Nelson, Richard Hunt","Kermit and his newfound friends trek across America to find success in Hollywood, but a frog legs merchant is after Kermit.",English,UK|USA,Nominated for 2 Oscars. Another 3 wins & 9 nominations.,7.6,28992.0
608,Fargo,Comedy|Crime|Drama|Thriller,1996,R,98 min,Ethan Coen|Joel Coen,Ethan Coen|Joel Coen,"William H. Macy, Steve Buscemi, Peter Stormare, Kristin Rudrüd",Jerry Lundegaard's inept crime falls apart due to his and his henchmen's bungling and the persistent police work of the quite pregnant Marge Gunderson.,English,UK|USA,Won 2 Oscars. Another 79 wins & 59 nominations.,8.1,550751.0
899,Singin' in the Rain,Comedy|Musical|Romance,1952,G,103 min,Gene Kelly|Stanley Donen,Adolph Green (story by)|Betty Comden (story by),"Gene Kelly, Donald O'Connor, Debbie Reynolds, Jean Hagen",A silent film production company and cast make a difficult transition to sound.,English,USA,Nominated for 2 Oscars. Another 5 wins & 7 nominations.,8.3,192187.0
334,Vanya on 42nd Street,Drama,1994,PG,119 min,Louis Malle,Andre Gregory (screenplay)|Anton Chekhov (play)|David Mamet (play),"Phoebe Brand, Lynn Cohen, George Gaynes, Jerry Mayer","""New York actors rehearse Chekhov's """"Uncle Vanya"""" in a dilapidated theatre.""",English,USA,2 wins & 12 nominations.,7.4,3889.0
953,It's a Wonderful Life,Children|Drama|Fantasy|Romance,1946,PG,130 min,Frank Capra,Albert Hackett (screenplay)|Frances Goodrich (screenplay)|Frank Capra (screenplay)|Jo Swerling (additional scenes)|Philip Van Doren Stern (story),"James Stewart, Donna Reed, Lionel Barrymore, Thomas Mitchell",An angel is sent from Heaven to help a desperately frustrated businessman by showing him what life would have been like if he had never existed.,English|French,USA,Nominated for 5 Oscars. Another 6 wins & 1 nomination.,8.6,349071.0
1617,L.A. Confidential,Crime|Film-Noir|Mystery|Thriller,1997,R,138 min,Curtis Hanson,Brian Helgeland (screenplay)|Curtis Hanson (screenplay)|James Ellroy (novel),"Kevin Spacey, Russell Crowe, Guy Pearce, James Cromwell","As corruption grows in 1950s Los Angeles, three policemen -- one strait-laced, one brutal, and one sleazy -- investigate a series of murders with their own brand of justice.",English,USA,Won 2 Oscars. Another 85 wins & 82 nominations.,8.3,485384.0
534,Shadowlands,Drama|Romance,1993,PG,131 min,Richard Attenborough,William Nicholson (play)|William Nicholson (screenplay),"Julian Fellowes, Roddy Maude-Roxby, Michael Denison, Andrew Seear","C.S. Lewis, a world-renowned Christian theologian, writer and professor, leads a passionless life until he meets a spirited poet from the U.S.",English,UK,Nominated for 2 Oscars. Another 7 wins & 11 nominations.,7.4,15084.0
2427,The Thin Red Line,Action|Drama|War,1998,R,170 min,Terrence Malick,James Jones (novel)|Terrence Malick (screenplay),"Kirk Acevedo, Penelope Allen, Benjamin Green, Simon Billig","Adaptation of James Jones' autobiographical 1962 novel, focusing on the conflict at Guadalcanal during the second World War.",English|Greek|Japanese|Tok Pisin,USA,Nominated for 7 Oscars. Another 20 wins & 40 nominations.,7.6,158403.0
1953,The French Connection,Action|Crime|Thriller,1971,R,104 min,William Friedkin,Ernest Tidyman (screenplay by)|Robin Moore (based on the book by),"Gene Hackman, Fernando Rey, Roy Scheider, Tony Lo Bianco",A pair of NYC cops in the Narcotics Bureau stumble onto a drug smuggling job with a French connection.,English|French,USA,Won 5 Oscars. Another 17 wins & 10 nominations.,7.8,97839.0
913,The Maltese Falcon,Film-Noir|Mystery,1941,NOT RATED,100 min,John Huston,Dashiell Hammett (based upon the novel by)|John Huston (screen play by),"Humphrey Bogart, Mary Astor, Gladys George, Peter Lorre","A private detective takes on a case that involves him with three eccentric criminals, a gorgeous liar, and their quest for a priceless statuette.",English,USA,Nominated for 3 Oscars. Another 4 wins.,8.1,138564.0
3145,Cradle Will Rock,Drama,1999,R,132 min,Tim Robbins,Tim Robbins,"Hank Azaria, Rubén Blades, Joan Cusack, John Cusack","A true story of politics and art in the 1930s U.S., focusing on a leftist musical drama and attempts to stop its production.",English|Italian,USA,5 wins & 7 nominations.,6.9,8415.0
260,Star Wars: Episode IV - A New Hope,Action|Adventure|Sci-Fi,1977,PG,121 min,George Lucas,George Lucas,"Mark Hamill, Harrison Ford, Carrie Fisher, Peter Cushing","Luke Skywalker joins forces with a Jedi Knight, a cocky pilot, a Wookiee and two droids to save the galaxy from the Empire's world-destroying battle station, while also attempting to rescue Princess Leia from the mysterious Darth Vader.",English,USA,Won 6 Oscars. Another 50 wins & 28 nominations.,8.6,1099272.0
1730,Kundun,Drama,1997,PG-13,134 min,Martin Scorsese,Melissa Mathison,"Tenzin Thuthob Tsarong, Gyurme Tethong, Tulku Jamyang Kunga Tenzin, Tenzin Yeshi Paichang","From childhood to adulthood, Tibet's fourteenth Dalai Lama deals with Chinese oppression and other problems.",English|Mandarin|Tibetan,Monaco|Morocco|USA,Nominated for 4 Oscars. Another 7 wins & 8 nominations.,7.0,23950.0
2917,Body Heat,Crime|Thriller,1981,R,113 min,Lawrence Kasdan,Lawrence Kasdan,"William Hurt, Kathleen Turner, Richard Crenna, Ted Danson","In the midst of a searing Florida heat wave, a woman persuades her lover, a small-town lawyer, to murder her rich husband.",English,USA,Nominated for 1 Golden Globe. Another 5 nominations.,7.4,27166.0
2028,Saving Private Ryan,Action|Drama|War,1998,R,169 min,Steven Spielberg,Robert Rodat,"Tom Hanks, Tom Sizemore, Edward Burns, Barry Pepper","Following the Normandy Landings, a group of U.S. soldiers go behind enemy lines to retrieve a paratrooper whose brothers have been killed in action.",Czech|English|French|German,USA,Won 5 Oscars. Another 74 wins & 74 nominations.,8.6,1084736.0
910,Some Like It Hot,Comedy|Crime,1959,NOT RATED,121 min,Billy Wilder,Billy Wilder (screenplay)|I.A.L. Diamond (screenplay)|Michael Logan (suggested by a story by)|Robert Thoeren (suggested by a story by),"Marilyn Monroe, Tony Curtis, Jack Lemmon, George Raft","When two male musicians witness a mob hit, they flee the state in an all-female band disguised as women, but further complications set in.",English,USA,Won 1 Oscar. Another 9 wins & 13 nominations.,8.2,215526.0
1228,Raging Bull,Drama,1980,R,129 min,Martin Scorsese,Jake LaMotta (based on the book by)|Joseph Carter (with)|Mardik Martin (screenplay)|Paul Schrader (screenplay)|Peter Savage (with),"Robert De Niro, Cathy Moriarty, Joe Pesci, Frank Vincent","The life of boxer Jake LaMotta, as the violence and temper that leads him to the top in the ring destroys his life outside of it.",English,USA,Won 2 Oscars. Another 22 wins & 26 nominations.,8.2,282808.0
2946,Help!,Comedy|Musical,1965,G,92 min,Richard Lester,Charles Wood (screenplay)|Marc Behm (screenplay)|Marc Behm (story),"The Beatles, Leo McKern, Eleanor Bron, Victor Spinetti",Ringo finds himself the human sacrifice target of a cult and the band must try to protect him from it.,English,UK,Nominated for 2 BAFTA Film Awards. Another 3 nominations.,7.3,15488.0
1285,Heathers,Comedy,1988,R,103 min,Michael Lehmann,Daniel Waters,"Winona Ryder, Christian Slater, Shannen Doherty, Lisanne Falk","In order to get out of the snobby clique that is destroying her good-girl reputation, an intelligent teen teams up with a dark sociopath in a plot to kill the cool kids.",English,USA,3 wins & 11 nominations.,7.3,76133.0
2303,Nashville,Drama|Musical,1975,R,160 min,Robert Altman,Joan Tewkesbury,"David Arkin, Barbara Baxley, Ned Beatty, Karen Black","Over the course of a few hectic days, numerous interrelated people prepare for a political convention as secrets and lies are surfaced and revealed.",English,USA,Won 1 Oscar. Another 22 wins & 25 nominations.,7.8,20668.0
1958,Terms of Endearment,Comedy|Drama,1983,PG,132 min,James L. Brooks,James L. Brooks (screenplay)|Larry McMurtry (based on the novel by),"Shirley MacLaine, Debra Winger, Jack Nicholson, Danny DeVito","Follows hard-to-please Aurora looking for love, and her daughter's family problems.",English,USA,Won 5 Oscars. Another 27 wins & 18 nominations.,7.4,48677.0
